Assis alinha com discurso de Seguro mas faz a defesa de Sócrates	more_entities		2011-09-10 13:11:00	http://www.publico.pt/1511280	Assis	Sócrates	https://www.wikidata.org/wiki/Q656518	https://www.wikidata.org/wiki/Q182367
Cavaco Silva envia mensagem a Obama manifestando “profunda solidariedade com o povo norte-americano”	ent1_supports_ent2		2011-09-11 17:44:00	http://www.publico.pt/1511424	Cavaco Silva	Obama	https://www.wikidata.org/wiki/Q57398	https://www.wikidata.org/wiki/Q76
Seguro diz que se Passos não quebrar silêncio quanto a Jardim, perde legitimidade para exigir sacrifícios	more_entities		2011-09-18 21:11:00	http://www.publico.pt/1512475	Seguro	Passos	http://www.wikidata.org/entity/Q1580316	https://www.wikidata.org/wiki/Q57615
César não atribui importância a visita aos Açores, mas diz que Cavaco “é bem-vindo”	other		2011-09-19 18:20:00	http://www.publico.pt/1512608	César	Cavaco	https://www.wikidata.org/wiki/Q2571494	https://www.wikidata.org/wiki/Q57398
César diz que visita Cavaco é boa ocasião para retomar o relacionamento com a região	other		2011-09-21 20:11:00	http://www.publico.pt/1513045	César	Cavaco	https://www.wikidata.org/wiki/Q2571494	https://www.wikidata.org/wiki/Q57398
Berta Cabral sauda visita de Cavaco, que “não é um cidadão igual aos outros”	ent1_supports_ent2		2011-09-24 21:11:00	http://www.publico.pt/1513544	Berta Cabral	Cavaco	https://www.wikidata.org/wiki/Q16498018	https://www.wikidata.org/wiki/Q57398
Vítor Gaspar cita Kafka para explicar desafios do Governo português	other		2011-09-24 21:58:00	http://www.publico.pt/1513548	Vítor Gaspar	Kafka	https://www.wikidata.org/entity/Q2118027	https://www.wikidata.org/wiki/Q905
Maximiano Martins (PS-M) condena "apelo à violência" de Alberto João Jardim	ent1_opposes_ent2		2011-09-27 14:40:00	http://www.publico.pt/1513919	Maximiano Martins	Alberto João Jardim	https://www.wikidata.org/wiki/Q65498301	https://www.wikidata.org/wiki/Q784504
Os Verdes acusam Cavaco Silva de ser “porta-voz do Governo”	ent1_opposes_ent2		2011-09-29 08:12:00	http://www.publico.pt/1514256	Verdes	Cavaco de Silva	https://www.wikidata.org/wiki/Q978086	https://www.wikidata.org/wiki/Q57398
Passos Coelho convidou Mahmud Abbas a visitar Portugal mas “não há datas marcadas”	other		2011-09-30 15:47:00	http://www.publico.pt/1514508	Passos Coelho	Mahmud Abbas	https://www.wikidata.org/wiki/Q57615	https://www.wikidata.org/wiki/Q127998
Louçã acusa Passos Coelho de conivência com “falcatrua eleitoral”	ent1_opposes_ent2		2011-10-04 20:14:00	http://www.publico.pt/1515107	Louçã	Passos Coelho	https://www.wikidata.org/wiki/Q1442096	https://www.wikidata.org/wiki/Q57615
Mário Soares elogia discurso “republicano” de Cavaco Silva	ent1_supports_ent2		2011-10-05 19:49:00	http://www.publico.pt/1515204	Mário Soares	Cavaco Silva	https://www.wikidata.org/wiki/Q156781	https://www.wikidata.org/wiki/Q57398
Carlos César acusa Cavaco Silva de ser o Presidente “mais partidário” desde o 25 de Abril	ent1_opposes_ent2		2011-10-16 08:16:00	http://www.publico.pt/1516730	Carlos César	Cavaco Silva	https://www.wikidata.org/wiki/Q2571494	https://www.wikidata.org/wiki/Q57398
Jerónimo de Sousa acusa Manuela Ferreira Leite de querer “salvaguardar a face” do Governo	ent1_opposes_ent2		2011-10-21 00:43:00	http://www.publico.pt/1517530	Jerónimo de Sousa	Manuela Ferreira Leite	https://www.wikidata.org/wiki/Q1688029	https://www.wikidata.org/wiki/Q444059
Passos diz que caso Duarte Lima é “do foro da justiça”	other		2011-10-28 07:18:00	http://www.publico.pt/1518624	Passos	Duarte Lima	https://www.wikidata.org/wiki/Q57615	https://www.wikidata.org/wiki/Q5290424
Jerónimo diz que discurso Cavaco sobre pastor lembra “ruralismo salazarista”	ent1_opposes_ent2		2011-11-09 21:11:00	http://www.publico.pt/1520245	Jerónimo	Cavaco	https://www.wikidata.org/wiki/Q1688029	https://www.wikidata.org/wiki/Q57398
Passos diverge de Cavaco no papel do BCE	ent1_opposes_ent2		2011-11-12 16:19:00	http://www.publico.pt/1520638	Passos	Cavaco	https://www.wikidata.org/wiki/Q57615	https://www.wikidata.org/wiki/Q57398
César apela Cavaco para impedir medidas alegadamente inconstitucionais	ent1_asks_action_ent2		2011-11-12 21:27:00	http://www.publico.pt/1520678	César	Cavaco	https://www.wikidata.org/wiki/Q2571494	https://www.wikidata.org/wiki/Q57398
Passos Coelho felicita Monti pela sua nomeação para primeiro-ministro italiano	other		2011-11-14 23:38:00	http://www.publico.pt/1520924	Passos Coelho	Monti	https://www.wikidata.org/wiki/Q57615	https://www.wikidata.org/wiki/Q47904
Soares critica Merkel pela “decadência” da Europa	ent1_opposes_ent2		2011-11-17 19:07:00	http://www.publico.pt/1521435	Soares	Merkel	https://www.wikidata.org/wiki/Q156781	https://www.wikidata.org/wiki/Q567
Manuel Alegre diz que Cavaco deve saber “interpretar angústias dos portugueses”	other		2011-11-20 11:52:00	http://www.publico.pt/1521735	Manuel Alegre	Cavaco	https://www.wikidata.org/wiki/Q737410	https://www.wikidata.org/wiki/Q57398
Mário Soares defende Seguro e diz que o seu partido "está em forma"	ent1_supports_ent2		2011-11-23 14:30:00	http://www.publico.pt/1522210	Mário Soares	Seguro	https://www.wikidata.org/wiki/Q156781	http://www.wikidata.org/entity/Q1580316
Cavaco recusa fazer comentários sobre manifesto encabeçado por Mário Soares	other		2011-11-23 20:03:00	http://www.publico.pt/1522269	Cavaco	Mário Soares	https://www.wikidata.org/wiki/Q57398	https://www.wikidata.org/wiki/Q156781
Mendes afirma que Soares está a cercar, minar e condicionar Seguro	more_entities		2011-11-24 22:49:00	http://www.publico.pt/1522448	Mendes	Soares	https://www.wikidata.org/wiki/Q550243	https://www.wikidata.org/wiki/Q156781
Líder do PS desafia Passos Coelho a não ficar refém de Merkel	other		2011-12-03 18:31:00	http://www.publico.pt/1523653	Passos Coelho	Merkel	https://www.wikidata.org/wiki/Q57615	https://www.wikidata.org/wiki/Q567
Mário Soares diz que “Merkel só faz asneiras”	ent1_opposes_ent2		2011-12-06 09:48:00	http://www.publico.pt/1523933	Mário Soares	Merkel	https://www.wikidata.org/wiki/Q156781	https://www.wikidata.org/wiki/Q567
Portas diz que teve de ler duas vezes declarações de Sócrates	other		2011-12-07 19:34:00	http://www.publico.pt/1524207	Portas	Sócrates	https://www.wikidata.org/wiki/Q58161	https://www.wikidata.org/wiki/Q182367
Inês Zuber substitui Ilda Figueiredo no Parlamento Europeu em Janeiro	ent1_replaces_ent2		2011-12-13 19:28:00	http://www.publico.pt/1524936	Inês Zuber	Ilda Figueiredo	https://www.wikidata.org/wiki/Q1671880	https://www.wikidata.org/wiki/Q3116195
Declarações de Pedro Nuno Santos sobre a dívida foram "infelizes", diz Marques Guedes	ent2_opposes_ent1		2011-12-15 14:33:00	http://www.publico.pt/1525219	Pedro Nuno Santos	Marques Guedes	https://www.wikidata.org/wiki/Q10347660	https://www.wikidata.org/wiki/Q11764395
Nem Salazar se atreveu a tocar no feriado de 5 de Outubro, diz Manuel Alegre	other		2011-12-15 16:11:00	http://www.publico.pt/1525242	Salazar	Manuel Alegre	https://www.wikidata.org/wiki/Q151394	https://www.wikidata.org/wiki/Q737410
PSD desafia Seguro a esclarecer se concorda com Pedro Nuno Santos	more_entities		2011-12-15 19:34:00	http://www.publico.pt/1525270	Seguro	Pedro Nuno Santos	http://www.wikidata.org/entity/Q1580316	https://www.wikidata.org/wiki/Q10347660
Para Jerónimo de Sousa, emigração proposta por Passos Coelho é inaceitável	ent1_opposes_ent2		2011-12-18 16:56:00	http://www.publico.pt/1525552	Jerónimo de Sousa	Passos Coelho	https://www.wikidata.org/wiki/Q1688029	https://www.wikidata.org/wiki/Q57615
Seguro pede para não se dramatizar encontro com Passos	other		2011-12-21 20:48:00	http://www.publico.pt/1526049	Seguro	Passos	http://www.wikidata.org/entity/Q1580316	https://www.wikidata.org/wiki/Q57615
Passos deseja boas-festas a Cavaco em clima de “grande e muito profícua cooperação”	other		2011-12-22 18:44:00	http://www.publico.pt/1526177	Passos	Cavaco	https://www.wikidata.org/wiki/Q57615	https://www.wikidata.org/wiki/Q57398
Marques Mendes critica Assunção Esteves por atraso no OE	ent1_opposes_ent2		2011-12-23 14:17:00	http://www.publico.pt/1526281	Marques Mendes	Assunção Esteves	https://www.wikidata.org/wiki/Q550243	https://www.wikidata.org/wiki/Q2868303
Carvalho da Silva considera “inaceitável” que Cavaco não tenha falado do mercado de trabalho	ent1_opposes_ent2		2012-01-02 07:51:00	http://www.publico.pt/1527208	Carvalho da Silva	Cavaco	https://www.wikidata.org/wiki/Q6752494	https://www.wikidata.org/wiki/Q57398
Ribau Esteves substitui Nogueira Leite na Associação Oceano XXI	ent1_replaces_ent2		2012-01-03 20:53:00	http://www.publico.pt/1527480	Ribau Esteves	Nogueira Leite	https://www.wikidata.org/wiki/Q10308703	https://www.wikidata.org/wiki/Q9619875
Seguro diz que caso Jerónimo Martins lhe deu razão	other		2012-01-04 22:46:00	http://www.publico.pt/1527664	Seguro	Jerónimo Martins	https://www.wikidata.org/entity/Q1580316	https://www.wikidata.org/wiki/Q1688026
Portas escusa-se a comentar decisão da Jerónimo Martins	other		2012-01-05 17:11:00	http://www.publico.pt/1527778	Portas	Jerónimo Martins	https://www.wikidata.org/wiki/Q58161	https://www.wikidata.org/wiki/Q1688026
Inquérito sobre licenciatura de Sócrates foi "transparente", diz Cândida Almeida	ent2_supports_ent1		2012-01-11 15:56:00	http://www.publico.pt/1528608	Sócrates	Cândida Almeida	https://www.wikidata.org/wiki/Q182367	None
Recusa de João Jardim é "razoável e compreensível", diz Guilherme Silva	ent2_supports_ent1		2012-01-12 11:34:00	http://www.publico.pt/1528739	João Jardim	Guilherme Silva	https://www.wikidata.org/wiki/Q784504	https://www.wikidata.org/wiki/Q10292842
Paulo Portas defende nomeação de Álvaro Castello-Branco para AdP	ent1_supports_ent2		2012-01-12 20:43:00	http://www.publico.pt/1528843	Paulo Portas	Álvaro Castello-Branco	https://www.wikidata.org/wiki/Q58161	https://www.wikidata.org/wiki/Q30934717
Sócrates terá "contratado" com o ex-director da Lusa cobertura noticiosa para o Governo, acusa José Manuel Fernandes	ent2_opposes_ent1		2012-01-17 18:47:00	http://www.publico.pt/1529496	Sócrates	José Manuel Fernandes	https://www.wikidata.org/wiki/Q182367	https://www.wikidata.org/wiki/Q10309880
Palavras de Cavaco foram um insulto aos pensionistas, diz Jerónimo	ent2_opposes_ent1		2012-01-21 05:03:00	http://www.publico.pt/1530054	Cavaco	Jerónimo	https://www.wikidata.org/wiki/Q57398	https://www.wikidata.org/wiki/Q1688029
Palavras de Cavaco mostram falta de perceção dos problemas do país, diz Carvalho da Silva	ent2_opposes_ent1		2012-01-21 18:13:00	http://www.publico.pt/1530121	Cavaco	Carvalho da Silva	https://www.wikidata.org/wiki/Q57398	https://www.wikidata.org/wiki/Q6752494
É "muito difícil" Cavaco "justificar o injustificável", diz Jerónimo de Sousa	ent2_opposes_ent1		2012-01-24 12:08:00	http://www.publico.pt/1530480	Cavaco	Jerónimo de Sousa	https://www.wikidata.org/wiki/Q57398	https://www.wikidata.org/wiki/Q1688029
Zorrinho espera que Cavaco continue a apelar à “sensibilidade do Governo”	ent1_asks_action_ent2		2012-01-24 16:27:00	http://www.publico.pt/1530512	Zorrinho	Cavaco	https://www.wikidata.org/wiki/Q15980671	https://www.wikidata.org/wiki/Q57398
Jerónimo sugere que Cavaco deveria pagar mais impostos	ent1_opposes_ent2		2012-01-29 16:48:00	http://www.publico.pt/1531264	Jerónimo	Cavaco	https://www.wikidata.org/wiki/Q1688029	https://www.wikidata.org/wiki/Q57398
André Figueiredo acusa Carrilho de ter passado de “traição” no PS	ent1_opposes_ent2		2012-02-02 18:24:00	http://www.publico.pt/1531984	André Figueiredo	Carrilho	None	https://www.wikidata.org/wiki/Q13582493
Mário Soares sem reacção lembra dificuldades de Cavaco quando retirou tolerância	other		2012-02-04 04:05:00	http://www.publico.pt/1532206	Mário Soares	Cavaco	https://www.wikidata.org/wiki/Q156781	https://www.wikidata.org/wiki/Q57398
Louçã afirma que Passos Coelho insultou portugueses	ent1_opposes_ent2		2012-02-07 15:22:00	http://www.publico.pt/1532662	Louçã	Passos Coelho	https://www.wikidata.org/wiki/Q1442096	https://www.wikidata.org/wiki/Q57615
Jornalista Pedro Rosa Mendes vai processar Luís Marinho por difamação	ent1_opposes_ent2		2012-02-08 09:37:00	http://www.publico.pt/1532782	Pedro Rosa Mendes	Luís Marinho	https://www.wikidata.org/wiki/Q1392332	https://www.wikidata.org/wiki/Q11764393
Seguro vai pedir explicações a Passos sobre flexibilização do plano da troika	other		2012-02-11 20:17:00	http://www.publico.pt/1533319	Seguro	Passos	http://www.wikidata.org/entity/Q1580316	https://www.wikidata.org/wiki/Q57615
Alberto João Jardim diz que vai convidar Merkel a visitar a Madeira	other		2012-02-12 08:19:00	http://www.publico.pt/1533363	Alberto João Jardim	Merkel	https://www.wikidata.org/wiki/Q784504	https://www.wikidata.org/wiki/Q567
Caso das escutas a Vara e Sócrates ainda não acabou, diz Paulo Penedos	other		2012-02-15 15:06:00	http://www.publico.pt/1533895	Sócrates	Paulo Penedos	https://www.wikidata.org/wiki/Q182367	None
Discussão gravíssima com Soares levou Sócrates a pedir ajuda externa	other		2012-02-17 02:39:00	http://www.publico.pt/1534144	Soares	Sócrates	https://www.wikidata.org/wiki/Q156781	https://www.wikidata.org/wiki/Q182367
Jerónimo de Sousa acusa Passos de contínua falta de coerência	ent1_opposes_ent2		2012-02-17 11:20:00	http://www.publico.pt/1534198	Jerónimo de Sousa	Passos	https://www.wikidata.org/wiki/Q1688029	https://www.wikidata.org/wiki/Q57615
Mendes diz que Passos corre o risco de perder as próximas legislativas	other		2012-02-18 01:29:00	http://www.publico.pt/1534314	Mendes	Passos	https://www.wikidata.org/wiki/Q550243	https://www.wikidata.org/wiki/Q57615
Sócrates tem "memória doce" de discussão "gravíssima" com Soares	other		2012-02-18 17:50:00	http://www.publico.pt/1534373	Sócrates	Soares	https://www.wikidata.org/wiki/Q182367	https://www.wikidata.org/wiki/Q156781
Cavaco “foi muito claro ao defender obrigações” de Portugal, diz Portas	ent2_supports_ent1		2012-02-29 15:04:00	http://www.publico.pt/1535836	Cavaco	Portas	https://www.wikidata.org/wiki/Q57398	https://www.wikidata.org/wiki/Q58161
Passos Coelho queria Carlos Coelho para secretário-geral, mas este declinou convite	other		2012-03-04 09:12:00	http://www.publico.pt/1536287	Passos Coelho	Carlos Coelho	https://www.wikidata.org/wiki/Q57615	https://www.wikidata.org/wiki/Q714076
Passos diz que Gaspar terá palavra “decisiva” nos fundos comunitários	ent1_supports_ent2		2012-03-04 11:54:00	http://www.publico.pt/1536295	Passos	Gaspar	https://www.wikidata.org/wiki/Q57615	http://www.wikidata.org/entity/Q2118027
Cavaco acusa Sócrates de falta de lealdade histórica	ent1_opposes_ent2		2012-03-09 01:14:00	http://www.publico.pt/1536984	Cavaco	Sócrates	https://www.wikidata.org/wiki/Q57398	https://www.wikidata.org/wiki/Q182367
Núcleo duro de Sócrates unido em ataque violento a Cavaco	more_entities		2012-03-09 18:24:00	http://www.publico.pt/1537096	Sócrates	Cavaco	https://www.wikidata.org/wiki/Q182367	https://www.wikidata.org/wiki/Q57398
José Luís Arnaut defende Cavaco e acusa PS de lidar mal com a verdade	more_entities		2012-03-10 15:51:00	http://www.publico.pt/1537198	José Luís Arnaut	Cavaco	https://www.wikidata.org/wiki/Q3186389	https://www.wikidata.org/wiki/Q57398
Carlos César lamenta falta de “sentido de Estado” de Cavaco Silva	ent1_opposes_ent2		2012-03-11 09:13:00	http://www.publico.pt/1537289	Carlos César	Cavaco Silva	https://www.wikidata.org/wiki/Q2571494	https://www.wikidata.org/wiki/Q57398
Cavaco diz que dever de informação de Sócrates era “transparente como a água”	other		2012-03-12 12:13:00	http://www.publico.pt/1537433	Cavaco	Sócrates	https://www.wikidata.org/wiki/Q57398	https://www.wikidata.org/wiki/Q182367
Amado diz que texto de Cavaco é "relativamente injusto"	ent1_opposes_ent2		2012-03-12 13:16:00	http://www.publico.pt/1537452	Amado	Cavaco	https://www.wikidata.org/wiki/Q1382641	https://www.wikidata.org/wiki/Q57398
Cavaco transformou mandato “numa espécie de algazarra permanente”, diz Louçã	ent2_opposes_ent1		2012-03-13 00:24:00	http://www.publico.pt/1537555	Cavaco	Louçã	https://www.wikidata.org/wiki/Q57398	https://www.wikidata.org/wiki/Q1442096
Henrique Gomes “bateu-se contra interesses instalados e perdeu”, diz Basílio Horta	ent2_opposes_ent1		2012-03-13 18:52:00	http://www.publico.pt/1537682	Henrique Gomes	Basílio Horta	None	https://www.wikidata.org/wiki/Q9650912
Jerónimo insiste em responsabilizar Passos por possibilidade de “morte antecipada de muitos portugueses”	ent1_opposes_ent2		2012-03-13 19:09:00	http://www.publico.pt/1537685	Jerónimo	Passos	https://www.wikidata.org/wiki/Q1688029	https://www.wikidata.org/wiki/Q57615
Pacheco Pereira diz que “a cama está posta” para um novo Sidónio Pais	other		2012-03-13 20:59:00	http://www.publico.pt/1537706	Pacheco Pereira	Sidónio Pais	https://www.wikidata.org/wiki/Q6293647	https://www.wikidata.org/wiki/Q356691
Jaime Gama diz que António Costa adquiriu “capacidade de auto-inventar o seu futuro”	other		2012-03-14 20:49:00	http://www.publico.pt/1537874	Jaime Gama	António Costa	https://www.wikidata.org/wiki/Q472589	https://www.wikidata.org/wiki/Q610788
José Lello diz que António Borges está a acumular cargos incompatíveis	ent1_opposes_ent2		2012-03-16 14:26:00	http://www.publico.pt/1538190	José Lello	António Borges	https://www.wikidata.org/wiki/Q64688	https://www.wikidata.org/wiki/Q4777532
Governo não se opõe ao regresso de António Borges à Jerónimo Martins	more_entities		2012-03-16 16:51:00	http://www.publico.pt/1538212	António Borges	Jerónimo Martins	https://www.wikidata.org/wiki/Q4777532	https://www.wikidata.org/wiki/Q1688026
Soares diz que cabe ao Governo resolver eventuais incompatibilidades de António Borges	more_entities		2012-03-17 02:07:00	http://www.publico.pt/1538266	Soares	António Borges	https://www.wikidata.org/wiki/Q156781	https://www.wikidata.org/wiki/Q4777532
Louçã aplaudiu declarações de António Arnaut sobre SNS	ent1_supports_ent2		2012-03-18 18:05:00	http://www.publico.pt/1538434	Louçã	António Arnaut	https://www.wikidata.org/wiki/Q1442096	https://www.wikidata.org/wiki/Q4777527
Caso António Borges é “uma pouca-vergonha", diz Jerónimo de Sousa	other		2012-03-18 18:11:00	http://www.publico.pt/1538438	António Borges	Jerónimo de Sousa	https://www.wikidata.org/wiki/Q4777532	https://www.wikidata.org/wiki/Q1688029
Seguro aceita testemunho de Sócrates no inquérito ao BPN	more_entities		2012-03-21 16:05:00	http://www.publico.pt/1538837	Seguro	Sócrates	http://www.wikidata.org/entity/Q1580316	https://www.wikidata.org/wiki/Q182367
Assis diz que está em curso uma gigantesca campanha para demonizar os governos de Sócrates	other		2012-03-29 14:50:00	http://www.publico.pt/1539901	Assis	Sócrates	https://www.wikidata.org/wiki/Q656518	https://www.wikidata.org/wiki/Q182367
António Costa critica Seguro por fingir que o passado do PS não existe	ent1_opposes_ent2		2012-03-30 14:32:00	http://www.publico.pt/1540075	António Costa	Seguro	https://www.wikidata.org/wiki/Q610788	http://www.wikidata.org/entity/Q1580316
António Galamba acusa Marcelo de mentir	ent1_opposes_ent2		2012-04-01 22:30:00	http://www.publico.pt/1540340	António Galamba	Marcelo	None	https://www.wikidata.org/wiki/Q6756617
Zorrinho acusa Marcelo de fazer “ataque de carácter” a Seguro	ent1_opposes_ent2		2012-04-02 16:47:00	http://www.publico.pt/1540438	Zorrinho	Marcelo	https://www.wikidata.org/wiki/Q15980671	https://www.wikidata.org/wiki/Q6756617
Isabel Moreira diz que advertência é “ilegal” e que Seguro também já violou disciplina de voto	ent1_opposes_ent2		2012-04-04 12:09:00	http://www.publico.pt/1540751	Isabel Moreira	Seguro	https://www.wikidata.org/wiki/Q19409554	http://www.wikidata.org/entity/Q1580316
José Lello diz que Zorrinho começa a ter "vida muito complicada"	other		2012-04-04 12:47:00	http://www.publico.pt/1540760	José Lello	Zorrinho	https://www.wikidata.org/wiki/Q64688	https://www.wikidata.org/wiki/Q15980671
Carlos Zorrinho já falou com Isabel Moreira mas não revela teor da conversa	other		2012-04-04 16:26:00	http://www.publico.pt/1540785	Carlos Zorrinho	Isabel Moreira	https://www.wikidata.org/wiki/Q15980671	https://www.wikidata.org/wiki/Q19409554
Lello diz que Zorrinho está a cumprir ordens de cima	ent1_supports_ent2		2012-04-04 17:20:00	http://www.publico.pt/1540793	Lello	Zorrinho	https://www.wikidata.org/wiki/Q64688	https://www.wikidata.org/wiki/Q15980671
Assis defende continuidade de Zorrinho como líder parlamentar	ent1_supports_ent2		2012-04-04 18:20:00	http://www.publico.pt/1540802	Assis	Zorrinho	https://www.wikidata.org/wiki/Q656518	https://www.wikidata.org/wiki/Q15980671
Fernando Jesus desmente José Lello e diz que está ao lado do líder parlamentar	ent1_supports_ent2		2012-04-04 18:30:00	http://www.publico.pt/1540804	Fernando Jesus	José Lello	None	https://www.wikidata.org/wiki/Q64688
Gaspar rejeita contradição com Passos sobre subsídios	other		2012-04-05 10:33:00	http://www.publico.pt/1540898	Gaspar	Passos	http://www.wikidata.org/entity/Q2118027	https://www.wikidata.org/wiki/Q57615
Zorrinho acusa Passos de não sair “do escritório de contabilidade que montou em Lisboa”	ent1_opposes_ent2		2012-04-16 10:34:00	http://www.publico.pt/1542259	Zorrinho	Passos	https://www.wikidata.org/wiki/Q15980671	https://www.wikidata.org/wiki/Q57615
Basílio Horta critica diplomacia económica de Paulo Portas	ent1_opposes_ent2		2012-04-17 12:08:00	http://www.publico.pt/1542411	Basílio Horta	Paulo Portas	https://www.wikidata.org/wiki/Q9650912	https://www.wikidata.org/wiki/Q58161
Soares diz que Passos está a fazer um “péssimo trabalho”	ent1_opposes_ent2		2012-04-19 15:03:00	http://www.publico.pt/1542739	Soares	Passos	https://www.wikidata.org/wiki/Q156781	https://www.wikidata.org/wiki/Q57615
Vasco Lourenço considera declarações de Passos impróprias dum primeiro-ministro	ent1_opposes_ent2		2012-04-24 22:33:00	http://www.publico.pt/1543441	Vasco Lourenço	Passos	https://www.wikidata.org/wiki/Q2511022	https://www.wikidata.org/wiki/Q57615
Júdice considera que Marinho Pinto “ultrapassou todos os limites” nas críticas à ministra	ent1_opposes_ent2		2012-04-30 15:30:00	http://www.publico.pt/1544157	Júdice	Marinho Pinto	https://www.wikidata.org/wiki/Q10310141	https://www.wikidata.org/wiki/Q611182
Assunção Esteves reitera dúvidas sobre candidatura de Conde Rodrigues ao TC	more_entities		2012-05-02 17:04:00	http://www.publico.pt/1544407	Assunção Esteves	Conde Rodrigues	https://www.wikidata.org/wiki/Q2868303	None
Assunção Esteves chumba Conde Rodrigues para o TC	other		2012-05-02 21:14:00	http://www.publico.pt/1544436	Assunção Esteves	Conde Rodrigues	https://www.wikidata.org/wiki/Q2868303	None
Alda Sousa substitui Miguel Portas no Parlamento Europeu	ent1_replaces_ent2		2012-05-03 19:20:00	http://www.publico.pt/1544577	Alda Sousa	Miguel Portas	https://www.wikidata.org/wiki/Q9144666	https://www.wikidata.org/wiki/Q3041550
Cavaco felicita Hollande pela vitória em França	other		2012-05-07 11:36:00	http://www.publico.pt/1545032	Cavaco	Hollande	https://www.wikidata.org/wiki/Q57398	https://www.wikidata.org/wiki/Q157
Paulo Portas espera contributos de François Hollande	ent1_asks_support_ent2		2012-05-07 13:47:00	http://www.publico.pt/1545050	Paulo Portas	François Hollande	https://www.wikidata.org/wiki/Q58161	https://www.wikidata.org/wiki/Q157
Louçã diz que declarações de Soares provam que “é preciso acabar com austeridade”	other		2012-05-08 15:18:00	http://www.publico.pt/1545199	Louçã	Soares	https://www.wikidata.org/wiki/Q1442096	https://www.wikidata.org/wiki/Q156781
Seguro reúne-se amanhã com Cavaco Silva	meet_together		2012-05-09 16:33:00	http://www.publico.pt/1545358	Seguro	Cavaco Silva	http://www.wikidata.org/entity/Q1580316	https://www.wikidata.org/wiki/Q57398
Silva Carvalho enviou plano de reforma das secretas a Miguel Relvas	other		2012-05-09 23:30:00	http://www.publico.pt/1545408	Silva Carvalho	Miguel Relvas	https://www.wikidata.org/wiki/Q10308143	https://www.wikidata.org/wiki/Q527722
Seguro diz a Cavaco que situação do país é “bastante grave”	other		2012-05-10 16:50:00	http://www.publico.pt/1545516	Seguro	Cavaco	http://www.wikidata.org/entity/Q1580316	https://www.wikidata.org/wiki/Q57398
Seguro diz que afirmação de Passos sobre desemprego foi má demais	ent1_opposes_ent2		2012-05-12 19:51:00	http://www.publico.pt/1545799	Seguro	Passos	http://www.wikidata.org/entity/Q1580316	https://www.wikidata.org/wiki/Q57615
Marcelo Rebelo de Sousa diz que declaração de Passos Coelho foi “desequilibrada”	ent1_opposes_ent2		2012-05-12 21:15:00	http://www.publico.pt/1545806	Marcelo Rebelo de Sousa	Passos Coelho	https://www.wikidata.org/wiki/Q6756617	https://www.wikidata.org/wiki/Q57615
Passos Coelho reúne-se com François Hollande no domingo	meet_together		2012-05-17 18:20:00	http://www.publico.pt/1546541	Passos Coelho	François Hollande	https://www.wikidata.org/wiki/Q57615	https://www.wikidata.org/wiki/Q157
Jerónimo de Sousa quer ouvir Miguel Relvas no Parlamento	ent1_opposes_ent2		2012-05-26 20:14:00	http://www.publico.pt/1547768	Jerónimo de Sousa	Miguel Relvas	https://www.wikidata.org/wiki/Q1688029	https://www.wikidata.org/wiki/Q527722
Pacheco Pereira acusa Miguel Relvas de ter mentido de todas as maneiras	ent1_opposes_ent2		2012-06-01 00:02:00	http://www.publico.pt/1548442	Pacheco Pereira	Miguel Relvas	https://www.wikidata.org/wiki/Q6293647	https://www.wikidata.org/wiki/Q527722
António Barreto diz não se identificar com Cavaco Silva	ent1_opposes_ent2		2012-06-08 20:20:00	http://www.publico.pt/1549550	António Barreto	Cavaco Silva	https://www.wikidata.org/wiki/Q2857756	https://www.wikidata.org/wiki/Q57398
