João Cravinho recorda Vasco Gonçalves como patriota e homem coerente	ent1_supports_ent2		2005-06-11 20:02:00	http://www.publico.pt/1225560	João Cravinho	Vasco Gonçalves	https://www.wikidata.org/wiki/Q64685	https://www.wikidata.org/wiki/Q712532
Sócrates lembra Vasco Gonçalves como homem de convicções e ideais	ent1_supports_ent2		2005-06-11 21:13:00	http://www.publico.pt/1225563	Sócrates	Vasco Gonçalves	https://www.wikidata.org/wiki/Q182367	https://www.wikidata.org/wiki/Q712532
Jorge Sampaio evoca marca de Vasco Gonçalves num período conturbado	ent1_supports_ent2		2005-06-11 21:34:00	http://www.publico.pt/1225565	Jorge Sampaio	Vasco Gonçalves	https://www.wikidata.org/wiki/Q156780	https://www.wikidata.org/wiki/Q712532
Jerónimo de Sousa lembra Vasco Gonçalves como intérprete mais genuíno dos ideais de Abril	ent1_supports_ent2		2005-06-12 09:39:00	http://www.publico.pt/1225587	Jerónimo de Sousa	Vasco Gonçalves	https://www.wikidata.org/wiki/Q1688029	https://www.wikidata.org/wiki/Q712532
Almeida Santos diz que José Sócrates é o primeiro a governar sem pensar em eleições	ent1_supports_ent2		2005-06-12 10:48:00	http://www.publico.pt/1225594	Almeida Santos	José Sócrates	https://www.wikidata.org/wiki/Q611579	https://www.wikidata.org/wiki/Q182367
Mário Soares recorda Álvaro Cunhal como homem de grande verticalidade	ent1_supports_ent2		2005-06-13 11:50:00	http://www.publico.pt/1225645	Mário Soares	Álvaro Cunhal	https://www.wikidata.org/wiki/Q156781	https://www.wikidata.org/wiki/Q250919
Jerónimo de Sousa antecipa regresso a Lisboa por causa da morte de Álvaro Cunhal	other		2005-06-13 12:26:00	http://www.publico.pt/1225648	Jerónimo de Sousa	Álvaro Cunhal	https://www.wikidata.org/wiki/Q1688029	https://www.wikidata.org/wiki/Q250919
Alberto João Jardim diz que morte de Álvaro Cunhal merece respeito	other		2005-06-13 13:06:00	http://www.publico.pt/1225653	Alberto João Jardim	Álvaro Cunhal	https://www.wikidata.org/wiki/Q784504	https://www.wikidata.org/wiki/Q250919
Jorge Sampaio lembra Álvaro Cunhal como combatente político e homem grande do século XX	other		2005-06-13 14:26:00	http://www.publico.pt/1225663	Jorge Sampaio	Álvaro Cunhal	https://www.wikidata.org/wiki/Q156780	https://www.wikidata.org/wiki/Q250919
Manuel Alegre lembra Álvaro Cunhal como um revolucionário e um aristocrata	other		2005-06-13 14:50:00	http://www.publico.pt/1225666	Manuel Alegre	Álvaro Cunhal	https://www.wikidata.org/wiki/Q737410	https://www.wikidata.org/wiki/Q250919
Almeida Santos recorda o seu "ídolo" Álvaro Cunhal	other		2005-06-13 16:04:00	http://www.publico.pt/1225673	Almeida Santos	Álvaro Cunhal	https://www.wikidata.org/wiki/Q611579	https://www.wikidata.org/wiki/Q250919
Jorge Sampaio lembra Álvaro Cunhal como “grande figura do século XX”	ent1_supports_ent2		2005-06-14 17:09:00	http://www.publico.pt/1225792	Jorge Sampaio	Álvaro Cunhal	https://www.wikidata.org/wiki/Q156780	https://www.wikidata.org/wiki/Q250919
Jerónimo de Sousa compara Governo de José Sócrates ao de Durão Barroso	other		2005-06-19 22:28:00	http://www.publico.pt/1226237	Jerónimo de Sousa	José Sócrates	https://www.wikidata.org/wiki/Q1688029	https://www.wikidata.org/wiki/Q182367
Almeida Santos triste com morte de Emídio Guerreiro	other		2005-06-29 21:19:00	http://www.publico.pt/1227080	Almeida Santos	Emídio Guerreiro	https://www.wikidata.org/wiki/Q611579	https://www.wikidata.org/wiki/Q1339831
Francisco Assis diz que Rui Rio está "incomodado com a cidade" do Porto	ent1_opposes_ent2		2005-07-02 21:45:00	http://www.publico.pt/1227360	Francisco Assis	Rui Rio	https://www.wikidata.org/wiki/Q656518	https://www.wikidata.org/wiki/Q7378729
José Miguel Júdice é o mandatário da candidatura de Maria José Nogueira Pinto	ent1_supports_ent2		2005-07-03 22:15:00	http://www.publico.pt/1227423	José Miguel Júdice	Maria José Nogueira Pinto	https://www.wikidata.org/wiki/Q10310141	https://www.wikidata.org/wiki/Q10325930
Sócrates recusa comentar eventual candidatura presidencial de Freitas do Amaral	other		2005-07-20 16:48:00	http://www.publico.pt/1228651	Sócrates	Freitas do Amaral	https://www.wikidata.org/wiki/Q182367	https://www.wikidata.org/wiki/Q438868
Sócrates propôs a Sampaio a exoneração do ministro das Finanças	other		2005-07-20 21:30:00	http://www.publico.pt/1228682	Sócrates	Sampaio	https://www.wikidata.org/wiki/Q182367	https://www.wikidata.org/wiki/Q156780
Sócrates garante apoio a eventual candidatura de Mário Soares	ent1_supports_ent2		2005-07-24 09:27:00	http://www.publico.pt/1228973	Sócrates	Mário Soares	https://www.wikidata.org/wiki/Q182367	https://www.wikidata.org/wiki/Q156781
Manuel Alegre não retira disponibilidade para se candidatar e recusa-se a apoiar Soares	ent1_opposes_ent2		2005-07-25 08:09:00	http://www.publico.pt/1229007	Manuel Alegre	Soares	https://www.wikidata.org/wiki/Q737410	https://www.wikidata.org/wiki/Q156781
José Sócrates reitera apoio a Mário Soares na corrida a Belém	ent1_supports_ent2		2005-07-25 18:32:00	http://www.publico.pt/1229072	José Sócrates	Mário Soares	https://www.wikidata.org/wiki/Q182367	https://www.wikidata.org/wiki/Q156781
Mário Soares vai ser recebido por Jorge Sampaio	meet_together		2005-08-01 19:29:00	http://www.publico.pt/1229612	Mário Soares	Jorge Sampaio	https://www.wikidata.org/wiki/Q156781	https://www.wikidata.org/wiki/Q156780
António Costa disse a José Sócrates que era desnecessário antecipar o regresso de férias	other		2005-08-11 17:36:00	http://www.publico.pt/1230381	António Costa	José Sócrates	https://www.wikidata.org/wiki/Q610788	https://www.wikidata.org/wiki/Q182367
José Sócrates considera que candidatura de Mário Soares "contribui para unir" portugueses	ent1_supports_ent2		2005-08-31 19:53:00	http://www.publico.pt/1231753	José Sócrates	Mário Soares	https://www.wikidata.org/wiki/Q182367	https://www.wikidata.org/wiki/Q156781
Sampaio manifesta a Bush "assombro e choque" pela devastação do "Katrina"	other		2005-09-02 13:52:00	http://www.publico.pt/1231885	Sampaio	Bush	https://www.wikidata.org/wiki/Q156780	https://www.wikidata.org/wiki/Q207
Candidatura de Mário Soares diz que sondagens ainda traduzem crise com Manuel Alegre	other		2005-09-09 21:32:00	http://www.publico.pt/1232462	Mário Soares	Manuel Alegre	https://www.wikidata.org/wiki/Q156781	https://www.wikidata.org/wiki/Q737410
Manuel Alegre recusou encontro a três para anunciar apoio a Mário Soares	ent1_supports_ent2		2005-09-12 17:13:00	http://www.publico.pt/1232654	Manuel Alegre	Mário Soares	https://www.wikidata.org/wiki/Q737410	https://www.wikidata.org/wiki/Q156781
Mário Soares diz que Cavaco Silva não tem perfil para Presidente	ent1_opposes_ent2		2005-09-14 09:22:00	http://www.publico.pt/1232798	Mário Soares	Cavaco Silva	https://www.wikidata.org/wiki/Q156781	https://www.wikidata.org/wiki/Q57398
Marques Mendes critica participação de António Vitorino nas negociações da Galp	ent1_opposes_ent2		2005-09-14 18:19:00	http://www.publico.pt/1232842	Marques Mendes	António Vitorino	https://www.wikidata.org/wiki/Q550243	https://www.wikidata.org/wiki/Q200941
CDS apela a Sampaio para recusar nomeação de Oliveira Martins para Tribunal de Contas	other		2005-09-15 18:32:00	http://www.publico.pt/1232950	Sampaio	Oliveira Martins	https://www.wikidata.org/wiki/Q156780	https://www.wikidata.org/wiki/Q3119570
Cimeira da ONU: Sampaio "apreciou" intervenção de Bush	other		2005-09-17 09:33:00	http://www.publico.pt/1233059	Sampaio	Bush	https://www.wikidata.org/wiki/Q156780	https://www.wikidata.org/wiki/Q207
Amarante: Louçã diz que candidatura de Ferreira Torres é "perigosíssima"	ent1_opposes_ent2		2005-09-17 23:16:00	http://www.publico.pt/1233108	Louçã	Ferreira Torres	https://www.wikidata.org/wiki/Q1442096	https://www.wikidata.org/wiki/Q16495518
Marques Mendes exige que Sócrates divulgue cortes no Orçamento antes das eleições	ent1_opposes_ent2		2005-09-21 19:02:00	http://www.publico.pt/1233457	Marques Mendes	Sócrates	https://www.wikidata.org/wiki/Q550243	https://www.wikidata.org/wiki/Q182367
Constitucionalista Jorge Miranda considera que Fátima Felgueiras não pode ficar detida	ent1_supports_ent2		2005-09-21 19:09:00	http://www.publico.pt/1233458	Jorge Miranda	Fátima Felgueiras	https://www.wikidata.org/wiki/Q10308185	https://www.wikidata.org/wiki/Q5511406
Jerónimo de Sousa apela a José Sócrates para "descer à terra"	ent1_opposes_ent2	1	2005-09-21 20:24:00	http://www.publico.pt/1233464	Jerónimo de Sousa	José Sócrates	https://www.wikidata.org/wiki/Q1688029	https://www.wikidata.org/wiki/Q182367
José Sócrates diz que não houve contactos entre PS e Fátima Felgueiras	other		2005-09-23 14:58:00	http://www.publico.pt/1233637	José Sócrates	Fátima Felgueiras	https://www.wikidata.org/wiki/Q182367	https://www.wikidata.org/wiki/Q5511406
Gonçalves Pereira acusa Valentim Loureiro de pressionar candidatos	ent1_opposes_ent2		2005-09-23 20:32:00	http://www.publico.pt/1233669	Gonçalves Pereira	Valentim Loureiro	None	https://www.wikidata.org/wiki/Q4007647
Jorge Coelho desdramatiza eventual candidatura presidencial de Manuel Alegre	other		2005-09-24 18:02:00	http://www.publico.pt/1233726	Jorge Coelho	Manuel Alegre	https://www.wikidata.org/wiki/Q3183808	https://www.wikidata.org/wiki/Q737410
Jerónimo de Sousa diz que candidatura de Manuel Alegre divide PS	other		2005-09-24 23:40:00	http://www.publico.pt/1233742	Jerónimo de Sousa	Manuel Alegre	https://www.wikidata.org/wiki/Q1688029	https://www.wikidata.org/wiki/Q737410
José Lello acusa Manuel Alegre de criar "ruído" na campanha autárquica	ent1_opposes_ent2		2005-09-25 18:04:00	http://www.publico.pt/1233789	José Lello	Manuel Alegre	https://www.wikidata.org/wiki/Q64688	https://www.wikidata.org/wiki/Q737410
Presidenciais: Alberto Martins afirma que candidato do PS é Mário Soares	ent1_supports_ent2		2005-09-26 12:55:00	http://www.publico.pt/1233855	Alberto Martins	Mário Soares	https://www.wikidata.org/wiki/Q2831797	https://www.wikidata.org/wiki/Q156781
Francisco Assis diz que Rui Rio "está a perder a serenidade"	ent1_opposes_ent2		2005-09-28 14:42:00	http://www.publico.pt/1234066	Francisco Assis	Rui Rio	https://www.wikidata.org/wiki/Q656518	https://www.wikidata.org/wiki/Q7378729
José Sócrates reúne-se domingo com Muammar Kadhafi em Tripoli	meet_together		2005-09-29 21:07:00	http://www.publico.pt/1234271	José Sócrates	Muammar Kadhafi	https://www.wikidata.org/wiki/Q182367	https://www.wikidata.org/wiki/Q19878
Rui Rio: "PSD é que não quis Paulo Morais nas listas"	other		2005-09-30 14:43:00	http://www.publico.pt/1234342	Rui Rio	Paulo Morais	https://www.wikidata.org/wiki/Q7378729	https://www.wikidata.org/wiki/Q18697787
Mário Soares diz que votaria em Manuel Alegre numa segunda volta	ent1_supports_ent2		2005-09-30 22:08:00	http://www.publico.pt/1234386	Mário Soares	Manuel Alegre	https://www.wikidata.org/wiki/Q156781	https://www.wikidata.org/wiki/Q737410
Francisco Assis acusa Rui Rio de ser "resignado, colérico e conflituoso"	ent1_opposes_ent2		2005-10-04 16:48:00	http://www.publico.pt/1234700	Francisco Assis	Rui Rio	https://www.wikidata.org/wiki/Q656518	https://www.wikidata.org/wiki/Q7378729
Aborto: Manuel Alegre diz que foi ouvido por Jorge Sampaio sobre o referendo	other		2005-10-05 07:43:00	http://www.publico.pt/1234728	Manuel Alegre	Jorge Sampaio	https://www.wikidata.org/wiki/Q737410	https://www.wikidata.org/wiki/Q156780
Jerónimo de Sousa recusa pedido de desculpas a Jorge Galamba	ent1_opposes_ent2		2005-10-06 13:03:00	http://www.publico.pt/1234818	Jerónimo de Sousa	Jorge Galamba	https://www.wikidata.org/wiki/Q1688029	None
Sá Fernandes submeteu Carmona Rodrigues ao “Polígrafo”	ent1_opposes_ent2		2005-10-06 20:49:00	http://www.publico.pt/1234857	Sá Fernandes	Carmona Rodrigues	https://www.wikidata.org/wiki/Q85876953	https://www.wikidata.org/wiki/Q5043745
Jorge Coelho diz que Fernando Seara é "um simpático que nada faz"	ent1_opposes_ent2		2005-10-06 23:42:00	http://www.publico.pt/1234866	Jorge Coelho	Fernando Seara	https://www.wikidata.org/wiki/Q3183808	https://www.wikidata.org/wiki/Q10281523
Teresa Zambujo reconhece vitória de Isaltino Morais	other		2005-10-09 22:22:00	http://www.publico.pt/1235098	Teresa Zambujo	Isaltino Morais	https://www.wikidata.org/wiki/Q10380539	https://www.wikidata.org/wiki/Q993533
Francisco Louçã considera José Sócrates o grande derrotado das autárquicas	other		2005-10-10 07:21:00	http://www.publico.pt/1235116	Francisco Louçã	José Sócrates	https://www.wikidata.org/wiki/Q1442096	https://www.wikidata.org/wiki/Q182367
Jorge Sampaio vai encontrar-se com Hugo Chávez à margem da cimeira ibero-americana	meet_together		2005-10-11 19:14:00	http://www.publico.pt/1235306	Jorge Sampaio	Hugo Chávez	https://www.wikidata.org/wiki/Q156780	https://www.wikidata.org/wiki/Q8440
José Manageiro afirma que ministro António Costa "está mal informado"	ent1_opposes_ent2		2005-10-12 15:35:00	http://www.publico.pt/1235395	José Manageiro	António Costa	None	https://www.wikidata.org/wiki/Q610788
Jerónimo de Sousa diz que Cavaco é o candidato do poder económico	ent1_opposes_ent2		2005-10-22 08:23:00	http://www.publico.pt/1236496	Jerónimo de Sousa	Cavaco	https://www.wikidata.org/wiki/Q1688029	https://www.wikidata.org/wiki/Q57398
Manuel Alegre classificou anúncio de Cavaco como uma coroação	other		2005-10-22 10:18:00	http://www.publico.pt/1236498	Manuel Alegre	Cavaco	https://www.wikidata.org/wiki/Q737410	https://www.wikidata.org/wiki/Q57398
Jorge Sampaio elogia competência e experiência de Guilherme d'Oliveira Martins	ent1_supports_ent2		2005-10-28 15:39:00	http://www.publico.pt/1237146	Jorge Sampaio	Guilherme d'Oliveira Martins	https://www.wikidata.org/wiki/Q156780	https://www.wikidata.org/wiki/Q3119570
Aborto: Marques Mendes diz que Sócrates reconheceu a "derrota"	other		2005-10-28 21:52:00	http://www.publico.pt/1237190	Marques Mendes	Sócrates	https://www.wikidata.org/wiki/Q550243	https://www.wikidata.org/wiki/Q182367
Mário Soares acusa Cavaco de ter reforma como "político profissional"	ent1_opposes_ent2		2005-10-29 21:00:00	http://www.publico.pt/1237263	Mário Soares	Cavaco	https://www.wikidata.org/wiki/Q156781	https://www.wikidata.org/wiki/Q57398
Presidenciais: Marques Mendes diz que outros candidatos apenas querem derrotar Cavaco	ent1_supports_ent2		2005-10-31 20:52:00	http://www.publico.pt/1237445	Marques Mendes	Cavaco	https://www.wikidata.org/wiki/Q550243	https://www.wikidata.org/wiki/Q57398
Soares acusa Cavaco de falta de coragem para assumir ser um político profissional	ent1_opposes_ent2		2005-11-01 15:08:00	http://www.publico.pt/1237499	Soares	Cavaco	https://www.wikidata.org/wiki/Q156781	https://www.wikidata.org/wiki/Q57398
Cavaco Silva recusa responder a ataque de Mário Soares	ent2_opposes_ent1		2005-11-01 16:00:00	http://www.publico.pt/1237503	Cavaco Silva	Mário Soares	https://www.wikidata.org/wiki/Q57398	https://www.wikidata.org/wiki/Q156781
António Costa acusa Sindicato dos Profissionais de Polícia de só dizer "asneiras e falsidades"	ent1_opposes_ent2		2005-11-03 23:08:00	http://www.publico.pt/1237750	António Costa	Sindicato dos Profissionais de Polícia	https://www.wikidata.org/wiki/Q610788	None
Santos Silva culpa PS e Manuel Alegre pela dupla candidatura presidencial	more_entities		2005-11-08 11:24:00	http://www.publico.pt/1238122	Santos Silva	Manuel Alegre	https://www.wikidata.org/wiki/Q769747	https://www.wikidata.org/wiki/Q737410
Mário Soares acusa Cavaco Silva de ser "um candidato esfinge"	ent1_opposes_ent2		2005-11-10 14:45:00	http://www.publico.pt/1238371	Mário Soares	Cavaco Silva	https://www.wikidata.org/wiki/Q156781	https://www.wikidata.org/wiki/Q57398
Cavaco Silva remete para os portugueses avaliação das críticas de Mário Soares	ent2_opposes_ent1		2005-11-10 15:07:00	http://www.publico.pt/1238373	Cavaco Silva	Mário Soares	https://www.wikidata.org/wiki/Q57398	https://www.wikidata.org/wiki/Q156781
Jerónimo de Sousa critica Cavaco Silva por se limitar a "gerir os silêncios"	ent1_opposes_ent2		2005-11-10 21:36:00	http://www.publico.pt/1238417	Jerónimo de Sousa	Cavaco Silva	https://www.wikidata.org/wiki/Q1688029	https://www.wikidata.org/wiki/Q57398
Jerónimo de Sousa acusa Manuel Alegre de inconsistência	ent1_opposes_ent2		2005-11-11 20:35:00	http://www.publico.pt/1238524	Jerónimo de Sousa	Manuel Alegre	https://www.wikidata.org/wiki/Q1688029	https://www.wikidata.org/wiki/Q737410
Manuel Alegre critica campanha agressiva de Jerónimo de Sousa	ent1_opposes_ent2		2005-11-12 17:43:00	http://www.publico.pt/1238588	Manuel Alegre	Jerónimo de Sousa	https://www.wikidata.org/wiki/Q737410	https://www.wikidata.org/wiki/Q1688029
Jerónimo de Sousa responde com novas críticas a comentários de Manuel Alegre	ent1_opposes_ent2		2005-11-13 18:05:00	http://www.publico.pt/1238654	Jerónimo de Sousa	Manuel Alegre	https://www.wikidata.org/wiki/Q1688029	https://www.wikidata.org/wiki/Q737410
Valentim Loureiro acusa Marques Mendes de tráfico de influências	ent1_opposes_ent2		2005-11-19 10:36:00	http://www.publico.pt/1239395	Valentim Loureiro	Marques Mendes	https://www.wikidata.org/wiki/Q4007647	https://www.wikidata.org/wiki/Q550243
Francisco Louçã critica Cavaco Silva por defender redução do orçamento comunitário	ent1_opposes_ent2		2005-11-19 19:39:00	http://www.publico.pt/1239421	Francisco Louçã	Cavaco Silva	https://www.wikidata.org/wiki/Q1442096	https://www.wikidata.org/wiki/Q57398
Sócrates diz que Soares esteve sempre do "lado certo da história"	ent1_supports_ent2		2005-11-20 18:48:00	http://www.publico.pt/1239489	Sócrates	Soares	https://www.wikidata.org/wiki/Q182367	https://www.wikidata.org/wiki/Q156781
Francisco Louçã acusa Valter Lemos de ter perdido mandato como vereador por faltas injustificadas	ent1_opposes_ent2		2005-11-20 19:29:00	http://www.publico.pt/1239492	Francisco Louçã	Valter Lemos	https://www.wikidata.org/wiki/Q1442096	None
Jerónimo de Sousa criticou declarações de Sampaio sobre as greves na justiça	ent1_opposes_ent2		2005-11-21 17:49:00	http://www.publico.pt/1239589	Jerónimo de Sousa	Sampaio	https://www.wikidata.org/wiki/Q1688029	https://www.wikidata.org/wiki/Q156780
Presidenciais: Manuel Alegre diz que era o "candidato desejado" por José Sócrates até Julho	other		2005-11-21 21:43:00	http://www.publico.pt/1239609	Manuel Alegre	José Sócrates	https://www.wikidata.org/wiki/Q737410	https://www.wikidata.org/wiki/Q182367
Mário Soares remete para PS comentários às revelações de Manuel Alegre	more_entities		2005-11-21 23:29:00	http://www.publico.pt/1239622	Mário Soares	Manuel Alegre	https://www.wikidata.org/wiki/Q156781	https://www.wikidata.org/wiki/Q737410
José Sócrates desmente Manuel Alegre sobre escolha do candidato às presidenciais	ent1_opposes_ent2		2005-11-22 18:36:00	http://www.publico.pt/1239728	José Sócrates	Manuel Alegre	https://www.wikidata.org/wiki/Q182367	https://www.wikidata.org/wiki/Q737410
Manuel Alegre desmente Sócrates e reafirma que foi o candidato desejado para as presidenciais	ent1_opposes_ent2		2005-11-22 19:00:00	http://www.publico.pt/1239733	Manuel Alegre	Sócrates	https://www.wikidata.org/wiki/Q737410	https://www.wikidata.org/wiki/Q182367
Mário Soares diz que José Sócrates o convidou para candidato presidencial	other		2005-11-24 22:27:00	http://www.publico.pt/1239979	Mário Soares	José Sócrates	https://www.wikidata.org/wiki/Q156781	https://www.wikidata.org/wiki/Q182367
Paulo Portas admite voltar a votar em Cavaco Silva	ent1_supports_ent2		2005-11-25 12:41:00	http://www.publico.pt/1240046	Paulo Portas	Cavaco Silva	https://www.wikidata.org/wiki/Q58161	https://www.wikidata.org/wiki/Q57398
Santana Lopes diz que Sampaio prejudicou Portugal ao dissolver o Parlamento	ent1_opposes_ent2		2005-11-26 10:57:00	http://www.publico.pt/1240144	Santana Lopes	Sampaio	https://www.wikidata.org/wiki/Q239248	https://www.wikidata.org/wiki/Q156780
Mário Soares acusa Cavaco Silva de ter descurado a educação enquanto primeiro-ministro	ent1_opposes_ent2		2005-12-01 18:47:00	http://www.publico.pt/1240710	Mário Soares	Cavaco Silva	https://www.wikidata.org/wiki/Q156781	https://www.wikidata.org/wiki/Q57398
Mário Soares: Cavaco Silva "tem vergonha do seu próprio partido"	ent1_opposes_ent2		2005-12-03 14:58:00	http://www.publico.pt/1240883	Mário Soares	Cavaco Silva	https://www.wikidata.org/wiki/Q156781	https://www.wikidata.org/wiki/Q57398
Mário Soares candidatou-se "para travar passeio triunfal" de Cavaco Silva	ent1_opposes_ent2		2005-12-04 10:57:00	http://www.publico.pt/1240931	Mário Soares	Cavaco Silva	https://www.wikidata.org/wiki/Q156781	https://www.wikidata.org/wiki/Q57398
Jerónimo responsabiliza Sócrates por desentendimento à esquerda	ent1_opposes_ent2		2005-12-04 14:30:00	http://www.publico.pt/1240937	Jerónimo	Sócrates	https://www.wikidata.org/wiki/Q1688029	https://www.wikidata.org/wiki/Q182367
Francisco Louçã reconhece dificuldades da esquerda no confronto com Cavaco Silva	other		2005-12-06 20:34:00	http://www.publico.pt/1241172	Francisco Louçã	Cavaco Silva	https://www.wikidata.org/wiki/Q1442096	https://www.wikidata.org/wiki/Q57398
Jerónimo de Sousa garante que vai até ao fim para derrotar Cavaco	ent1_opposes_ent2		2005-12-06 23:47:00	http://www.publico.pt/1241181	Jerónimo de Sousa	Cavaco	https://www.wikidata.org/wiki/Q1688029	https://www.wikidata.org/wiki/Q57398
Manuel Alegre: "Estarei sempre alerta" se Cavaco vencer as Presidenciais	other		2005-12-07 16:05:00	http://www.publico.pt/1241262	Manuel Alegre	Cavaco	https://www.wikidata.org/wiki/Q737410	https://www.wikidata.org/wiki/Q57398
Candidatura de Francisco Louçã condena agressão a Mário Soares	other		2005-12-12 14:19:00	http://www.publico.pt/1241668	Francisco Louçã	Mário Soares	https://www.wikidata.org/wiki/Q1442096	https://www.wikidata.org/wiki/Q156781
Louçã critica Cavaco por se mostrar preocupado com desemprego	ent1_opposes_ent2		2005-12-12 19:56:00	http://www.publico.pt/1241698	Louçã	Cavaco	https://www.wikidata.org/wiki/Q1442096	https://www.wikidata.org/wiki/Q57398
Jerónimo de Sousa: Cavaco Silva representa direita inconformada com 25 Abril	ent1_opposes_ent2		2005-12-13 17:28:00	http://www.publico.pt/1241801	Jerónimo de Sousa	Cavaco Silva	https://www.wikidata.org/wiki/Q1688029	https://www.wikidata.org/wiki/Q57398
Jerónimo de Sousa garante que não desiste a favor de Mário Soares	ent1_opposes_ent2		2005-12-15 18:44:00	http://www.publico.pt/1242029	Jerónimo de Sousa	Mário Soares	https://www.wikidata.org/wiki/Q1688029	https://www.wikidata.org/wiki/Q156781
Soares acusa Cavaco de falar só de economia e fugir a outros temas	ent1_opposes_ent2		2005-12-15 20:54:00	http://www.publico.pt/1242035	Soares	Cavaco	https://www.wikidata.org/wiki/Q156781	https://www.wikidata.org/wiki/Q57398
Marques Mendes diz que Cavaco Silva é um "farol de esperança"	ent1_supports_ent2		2005-12-19 11:45:00	http://www.publico.pt/1242304	Marques Mendes	Cavaco Silva	https://www.wikidata.org/wiki/Q550243	https://www.wikidata.org/wiki/Q57398
Sócrates promete fazer "o que puder" para estar ao lado de Mário Soares	ent1_supports_ent2		2005-12-20 08:59:00	http://www.publico.pt/1242397	Sócrates	Mário Soares	https://www.wikidata.org/wiki/Q182367	https://www.wikidata.org/wiki/Q156781
Mário Soares não poupa ataques a Cavaco Silva em frente-a-frente	ent1_opposes_ent2		2005-12-20 23:17:00	http://www.publico.pt/1242463	Mário Soares	Cavaco Silva	https://www.wikidata.org/wiki/Q156781	https://www.wikidata.org/wiki/Q57398
Soares ao ataque, Cavaco "à espera das ideias" do adversário	other		2005-12-21 07:56:00	http://www.publico.pt/1242489	Soares	Cavaco	https://www.wikidata.org/wiki/Q156781	https://www.wikidata.org/wiki/Q57398
Cavaco desvaloriza ataques de Soares no debate de ontem	ent2_opposes_ent1		2005-12-21 19:07:00	http://www.publico.pt/1242559	Cavaco	Soares	https://www.wikidata.org/wiki/Q57398	https://www.wikidata.org/wiki/Q156781
Francisco Louçã critica "arrogância" de Cavaco Silva	ent1_opposes_ent2		2005-12-22 11:51:00	http://www.publico.pt/1242622	Francisco Louçã	Cavaco Silva	https://www.wikidata.org/wiki/Q1442096	https://www.wikidata.org/wiki/Q57398
Francisco Louçã: PS "não tem vontade de disputar vitória a Cavaco"	more_entities		2005-12-22 12:24:00	http://www.publico.pt/1242624	Francisco Louçã	Cavaco	https://www.wikidata.org/wiki/Q1442096	https://www.wikidata.org/wiki/Q57398
Mário Soares afirma que uma eleição de Cavaco Silva seria "perigosa"	ent1_opposes_ent2		2005-12-28 11:30:00	http://www.publico.pt/1243084	Mário Soares	Cavaco Silva	https://www.wikidata.org/wiki/Q156781	https://www.wikidata.org/wiki/Q57398
Jerónimo de Sousa acusa Cavaco de querer ajuste de contas com 25 de Abril	ent1_opposes_ent2		2005-12-29 22:08:00	http://www.publico.pt/1243228	Jerónimo de Sousa	Cavaco	https://www.wikidata.org/wiki/Q1688029	https://www.wikidata.org/wiki/Q57398
Soares acusa grupos de comunicação social de apoiarem Cavaco	ent1_opposes_ent2		2006-01-03 17:23:00	http://www.publico.pt/1243582	Soares	Cavaco	https://www.wikidata.org/wiki/Q156781	https://www.wikidata.org/wiki/Q57398
Cavaco diz que jornalistas devem avaliar veracidade das acusações de Soares	ent2_opposes_ent1		2006-01-03 19:06:00	http://www.publico.pt/1243600	Cavaco	Soares	https://www.wikidata.org/wiki/Q57398	https://www.wikidata.org/wiki/Q156781
Soares apela à "sabedoria" dos portugueses para levar Cavaco à segunda volta	other		2006-01-04 19:48:00	http://www.publico.pt/1243720	Soares	Cavaco	https://www.wikidata.org/wiki/Q156781	https://www.wikidata.org/wiki/Q57398
Mário Soares promete revelar lista de financiadores se Cavaco o fizer	other		2006-01-05 21:02:00	http://www.publico.pt/1243834	Mário Soares	Cavaco	https://www.wikidata.org/wiki/Q156781	https://www.wikidata.org/wiki/Q57398
