Rui Moreira criticou Cavaco por falar sobre a TVI	ent1_opposes_ent2		2009-06-25 15:08:00	http://www.publico.pt/1388656	Rui Moreira	Cavaco	https://www.wikidata.org/wiki/Q16940732	https://www.wikidata.org/wiki/Q57398
Ferreira Leite critica Jorge Miranda por se rebelar contra resultado da eleição	ent1_opposes_ent2		2009-06-25 15:17:00	http://www.publico.pt/1388660	Ferreira Leite	Jorge Miranda	https://www.wikidata.org/wiki/Q444059	https://www.wikidata.org/wiki/Q10308185
Silva Pereira acusa Ferreira Leite de lançar "suspeições totalmente infundadas"	ent1_opposes_ent2		2009-06-25 17:30:00	http://www.publico.pt/1388698	Silva Pereira	Ferreira Leite	https://www.wikidata.org/wiki/Q2066785	https://www.wikidata.org/wiki/Q444059
Jerónimo de Sousa quer esclarecimentos de Sócrates	ent1_opposes_ent2		2009-06-25 19:23:00	http://www.publico.pt/1388720	Jerónimo de Sousa	Sócrates	https://www.wikidata.org/wiki/Q1688029	https://www.wikidata.org/wiki/Q182367
Ferreira Leite promete ruptura com políticas de José Sócrates	ent1_opposes_ent2		2009-06-25 22:40:00	http://www.publico.pt/1388748	Ferreira Leite	José Sócrates	https://www.wikidata.org/wiki/Q444059	https://www.wikidata.org/wiki/Q182367
Ferreira Leite acusa Sócrates de utilizar golden share na PT para defender a sua imagem	ent1_opposes_ent2		2009-06-26 14:11:00	http://www.publico.pt/1388869	Ferreira Leite	Sócrates	https://www.wikidata.org/wiki/Q444059	https://www.wikidata.org/wiki/Q182367
Santos Silva "duvida" de colagem de Cavaco ao PSD	more_entities		2009-07-01 19:32:00	http://www.publico.pt/1389778	Santos Silva	Cavaco	https://www.wikidata.org/wiki/Q769747	https://www.wikidata.org/wiki/Q57398
José Sócrates aceitou a demissão de Manuel Pinho	other		2009-07-02 19:34:00	http://www.publico.pt/1389976	José Sócrates	Manuel Pinho	https://www.wikidata.org/wiki/Q182367	https://www.wikidata.org/wiki/Q1382767
Paulo Pedroso adverte que Teixeira dos Santos será sujeito a enorme sobrecarga	ent1_supports_ent2		2009-07-03 12:03:00	http://www.publico.pt/1390097	Paulo Pedroso	Teixeira dos Santos	https://www.wikidata.org/wiki/Q7155277	https://www.wikidata.org/wiki/Q586749
Alegre elogia Sócrates na substituição de Pinho	ent1_supports_ent2		2009-07-03 14:03:00	http://www.publico.pt/1390135	Alegre	Sócrates	https://www.wikidata.org/wiki/Q737410	https://www.wikidata.org/wiki/Q182367
Henrique Neto diz que Pinho devia ter sido demitido há três anos	ent1_opposes_ent2		2009-07-03 19:00:00	http://www.publico.pt/1390207	Henrique Neto	Pinho	https://www.wikidata.org/wiki/Q5716738	https://www.wikidata.org/wiki/Q1382767
Cavaco Silva felicita Barack Obama no Dia da Independência dos EUA	other		2009-07-04 18:59:00	http://www.publico.pt/1390291	Cavaco Silva	Barack Obama	https://www.wikidata.org/wiki/Q57398	https://www.wikidata.org/wiki/Q76
CDS-PP indica Teresa Caeiro para substituir Nuno Melo na vice-presidência do Parlamento	ent1_replaces_ent2		2009-07-08 21:48:00	http://www.publico.pt/1390935	Teresa Caeiro	Nuno Melo	https://www.wikidata.org/wiki/Q3038797	https://www.wikidata.org/wiki/Q10338219
Louçã diz que o Bloco é a força capaz de provocar o sobressalto pedido por Manuel Alegre	more_entities		2009-07-12 00:10:00	http://www.publico.pt/1391375	Louçã	Manuel Alegre	https://www.wikidata.org/wiki/Q1442096	https://www.wikidata.org/wiki/Q737410
Santana Lopes: António Costa recorre a coligações com medo de perder autárquicas	ent1_opposes_ent2		2009-07-15 11:00:00	http://www.publico.pt/1391850	Santana Lopes	António Costa	https://www.wikidata.org/wiki/Q239248	https://www.wikidata.org/wiki/Q610788
Isaltino Morais acusa MP de ser permeável “a influências do PSD”	ent1_opposes_ent2		2009-07-16 15:52:00	http://www.publico.pt/1392029	Isaltino Morais	MP	https://www.wikidata.org/wiki/Q993533	None
Elisa Ferreira volta a afirmar que não será vereadora de Rui Rio	ent1_opposes_ent2		2009-07-21 08:53:00	http://www.publico.pt/1392633	Elisa Ferreira	Rui Rio	https://www.wikidata.org/wiki/Q5361358	https://www.wikidata.org/wiki/Q7378729
PS candidata Inês de Medeiros e Miguel Vale de Almeida a deputados por Lisboa	more_entities		2009-07-23 23:43:00	http://www.publico.pt/1393085	Inês de Medeiros	Miguel Vale de Almeida	https://www.wikidata.org/wiki/Q260092	https://www.wikidata.org/wiki/Q6844839
Louçã diz que Sócrates "desistiu de ser primeiro-ministro"	ent1_opposes_ent2		2009-07-24 20:20:00	http://www.publico.pt/1393226	Louçã	Sócrates	https://www.wikidata.org/wiki/Q1442096	https://www.wikidata.org/wiki/Q182367
Francisco Assis encabeça lista da Guarda a pedido de Sócrates	ent1_supports_ent2		2009-07-25 14:19:00	http://www.publico.pt/1393282	Francisco Assis	Sócrates	https://www.wikidata.org/wiki/Q656518	https://www.wikidata.org/wiki/Q182367
Louçã acusa Sócrates de tráfico de influências	ent1_opposes_ent2		2009-07-25 17:36:00	http://www.publico.pt/1393297	Louçã	Sócrates	https://www.wikidata.org/wiki/Q1442096	https://www.wikidata.org/wiki/Q182367
Vieria da Silva acusa Louçã de "mentira grosseira"	ent1_opposes_ent2		2009-07-26 13:39:00	http://www.publico.pt/1393365	Vieria da Silva	Louçã	https://www.wikidata.org/wiki/Q1709692	https://www.wikidata.org/wiki/Q1442096
Joana Amaral Dias confirma convite de Paulo Campos para integrar as listas do PS	ent2_supports_ent1		2009-08-01 13:26:00	http://www.publico.pt/1394237	Joana Amaral Dias	Paulo Campos	https://www.wikidata.org/wiki/Q6205661	None
Distrital de Setúbal pede a Ferreira Leite para "reequacionar" Fernando Negrão	other		2009-08-04 17:53:00	http://www.publico.pt/1394696	Ferreira Leite	Fernando Negrão	https://www.wikidata.org/wiki/Q444059	https://www.wikidata.org/wiki/Q10281462
Ferreira Leite falou a Portas sobre Nogueira Pinto	other		2009-08-06 10:26:00	http://www.publico.pt/1394957	Ferreira Leite	Nogueira Pinto	https://www.wikidata.org/wiki/Q444059	https://www.wikidata.org/wiki/Q10325930
Conselho de Bioética: Paulo Rangel garante que PS deu indicação que iria nomear Lobo Antunes	more_entities		2009-08-08 14:38:00	http://www.publico.pt/1395268	Paulo Rangel	Lobo Antunes	https://www.wikidata.org/wiki/Q10346767	https://www.wikidata.org/wiki/Q6298213
Marinho Pinto lamenta que Cavaco questione "apenas medidas favoráveis aos reclusos"	ent1_opposes_ent2		2009-08-13 17:32:00	http://www.publico.pt/1396021	Marinho Pinto	Cavaco	https://www.wikidata.org/wiki/Q611182	https://www.wikidata.org/wiki/Q57398
Socialistas próximos de José Sócrates lançam forte ataque a Cavaco Silva	more_entities		2009-08-15 09:07:00	http://www.publico.pt/1396257	José Sócrates	Cavaco Silva	https://www.wikidata.org/wiki/Q182367	https://www.wikidata.org/wiki/Q57398
Jerónimo de Sousa acusa Aguiar Branco de usar expressões do sótão do anti-comunismo	ent1_opposes_ent2		2009-08-16 18:37:00	http://www.publico.pt/1396368	Jerónimo de Sousa	Aguiar Branco	https://www.wikidata.org/wiki/Q1688029	https://www.wikidata.org/wiki/Q1555060
Suzana Toscano, assessora do Presidente, desmente José Junqueiro	ent1_opposes_ent2		2009-08-19 13:23:00	http://www.publico.pt/1396782	Suzana Toscano	José Junqueiro	None	None
Sócrates só aceita dois debates frente-a-frente com Ferreira Leite	other		2009-08-19 16:45:00	http://www.publico.pt/1396820	Sócrates	Ferreira Leite	https://www.wikidata.org/wiki/Q182367	https://www.wikidata.org/wiki/Q444059
Ferreira Leite tem falta de ideias e propostas, acusa Santos Silva	ent2_opposes_ent1		2009-08-21 13:51:00	http://www.publico.pt/1397141	Ferreira Leite	Santos Silva	https://www.wikidata.org/wiki/Q444059	https://www.wikidata.org/wiki/Q769747
Paulo Portas acusa Sócrates de ser insensível às dificuldades dos portugueses em crise	ent1_opposes_ent2		2009-08-23 02:56:00	http://www.publico.pt/1397305	Paulo Portas	Sócrates	https://www.wikidata.org/wiki/Q58161	https://www.wikidata.org/wiki/Q182367
Jerónimo de Sousa acredita que política de direita de Sócrates pode derrotar o PS	other		2009-08-25 15:53:00	http://www.publico.pt/1397678	Jerónimo de Sousa	Sócrates	https://www.wikidata.org/wiki/Q1688029	https://www.wikidata.org/wiki/Q182367
Ferreira Leite acusa Sócrates de transformar Estado numa “máquina ao serviço do poder”	ent1_opposes_ent2		2009-08-30 13:41:00	http://www.publico.pt/1398360	Ferreira Leite	Sócrates	https://www.wikidata.org/wiki/Q444059	https://www.wikidata.org/wiki/Q182367
Ferreira Leite acusa Sócrates de representar e de nem consigo próprio falar verdade	ent1_opposes_ent2		2009-09-02 12:48:00	http://www.publico.pt/1398792	Ferreira Leite	Sócrates	https://www.wikidata.org/wiki/Q444059	https://www.wikidata.org/wiki/Q182367
Paulo Rangel classificou entrevista de Sócrates como "infantil"	ent1_opposes_ent2		2009-09-02 21:34:00	http://www.publico.pt/1398871	Paulo Rangel	Sócrates	https://www.wikidata.org/wiki/Q10346767	https://www.wikidata.org/wiki/Q182367
PS acusa Pacheco Pereira de caluniar José Sócrates com declarações sobre TVI	more_entities		2009-09-05 23:55:00	http://www.publico.pt/1399302	Pacheco Pereira	José Sócrates	https://www.wikidata.org/wiki/Q6293647	https://www.wikidata.org/wiki/Q182367
Louçã desvaloriza críticas de Joana Amaral Dias	ent2_opposes_ent1		2009-09-06 17:11:00	http://www.publico.pt/1399370	Louçã	Joana Amaral Dias	https://www.wikidata.org/wiki/Q1442096	https://www.wikidata.org/wiki/Q6205661
Portas diz que Sócrates "está em dívida para com o país"	ent1_opposes_ent2		2009-09-06 19:05:00	http://www.publico.pt/1399385	Portas	Sócrates	https://www.wikidata.org/wiki/Q58161	https://www.wikidata.org/wiki/Q182367
Louçã acusa Ferreira Leite de "estar contente" com "asfixia democrática que se vive na Madeira"	ent1_opposes_ent2		2009-09-07 19:09:00	http://www.publico.pt/1399536	Louçã	Ferreira Leite	https://www.wikidata.org/wiki/Q1442096	https://www.wikidata.org/wiki/Q444059
Portas diz que Sócrates é “controleiro” mas também ataca “caciquismo” de Jardim	ent1_opposes_ent2		2009-09-08 15:23:00	http://www.publico.pt/1399669	Portas	Sócrates	https://www.wikidata.org/wiki/Q58161	https://www.wikidata.org/wiki/Q182367
Ferreira Leite recorda elogios de Jaime Gama à democracia na Madeira	other		2009-09-08 19:36:00	http://www.publico.pt/1399714	Ferreira Leite	Jaime Gama	https://www.wikidata.org/wiki/Q444059	https://www.wikidata.org/wiki/Q472589
Mário Lino desafia Louçã a identificar obras com grandes derrapagens	ent1_opposes_ent2		2009-09-11 17:08:00	http://www.publico.pt/1400274	Mário Lino	Louçã	https://www.wikidata.org/wiki/Q357941	https://www.wikidata.org/wiki/Q1442096
Portas assinala ausência de vários temas do debate Sócrates/Ferreira Leite	other		2009-09-13 12:46:00	http://www.publico.pt/1400462	Sócrates	Ferreira Leite	https://www.wikidata.org/wiki/Q182367	https://www.wikidata.org/wiki/Q444059
José Sócrates acusa Ferreira Leite de “ataque antidemocrático” por causa do TGV	ent1_opposes_ent2		2009-09-13 23:08:00	http://www.publico.pt/1400510	José Sócrates	Ferreira Leite	https://www.wikidata.org/wiki/Q182367	https://www.wikidata.org/wiki/Q444059
Sócrates lembra Ferreira Leite que “estamos integrados na Europa”	other		2009-09-14 14:53:00	http://www.publico.pt/1400601	Sócrates	Ferreira Leite	https://www.wikidata.org/wiki/Q182367	https://www.wikidata.org/wiki/Q444059
Louçã acusa Ferreira Leite de repetir a rotina Jardim	ent1_opposes_ent2		2009-09-14 21:56:00	http://www.publico.pt/1400652	Louçã	Ferreira Leite	https://www.wikidata.org/wiki/Q1442096	https://www.wikidata.org/wiki/Q444059
Louçã ajusta contas com Sócrates por causa dos PPR	ent1_opposes_ent2		2009-09-15 08:30:00	http://www.publico.pt/1400692	Louçã	Sócrates	https://www.wikidata.org/wiki/Q1442096	https://www.wikidata.org/wiki/Q182367
Jerónimo de Sousa desvaloriza saída de Domingos Lopes do PCP	other		2009-09-15 10:44:00	http://www.publico.pt/1400718	Jerónimo de Sousa	Domingos Lopes	https://www.wikidata.org/wiki/Q1688029	None
Ferreira Leite acusa Sócrates de mentir “duas vezes” na segurança social	ent1_opposes_ent2		2009-09-15 22:04:00	http://www.publico.pt/1400812	Ferreira Leite	Sócrates	https://www.wikidata.org/wiki/Q444059	https://www.wikidata.org/wiki/Q182367
Luís Amado invoca a Ibéria para criticar Ferreira Leite	ent1_opposes_ent2		2009-09-16 00:02:00	http://www.publico.pt/1400819	Luís Amado	Ferreira Leite	https://www.wikidata.org/wiki/Q1382641	https://www.wikidata.org/wiki/Q444059
Cuidado com o Sócrates “bonzinho e delicado”, avisa Jerónimo de Sousa	ent2_opposes_ent1		2009-09-16 00:07:00	http://www.publico.pt/1400823	Sócrates	Jerónimo de Sousa	https://www.wikidata.org/wiki/Q182367	https://www.wikidata.org/wiki/Q1688029
Sócrates critica Manuela Ferreira Leite e faz o elogio do TGV	ent1_opposes_ent2		2009-09-17 21:01:00	http://www.publico.pt/1401184	Sócrates	Manuela Ferreira Leite	https://www.wikidata.org/wiki/Q182367	https://www.wikidata.org/wiki/Q444059
Paulo Portas joga cartada contra Jaime Silva e exalta-se na rua	ent1_opposes_ent2		2009-09-18 20:18:00	http://www.publico.pt/1401351	Paulo Portas	Jaime Silva	https://www.wikidata.org/wiki/Q58161	https://www.wikidata.org/wiki/Q921602
Ferreira Leite acusa Sócrates de bloquear o país pelo medo	ent1_opposes_ent2		2009-09-19 09:01:00	http://www.publico.pt/1401389	Ferreira Leite	Sócrates	https://www.wikidata.org/wiki/Q444059	https://www.wikidata.org/wiki/Q182367
Jerónimo de Sousa desvaloriza actuação de Louçã nos PPR	ent1_opposes_ent2		2009-09-19 13:04:00	http://www.publico.pt/1401414	Jerónimo de Sousa	Louçã	https://www.wikidata.org/wiki/Q1688029	https://www.wikidata.org/wiki/Q1442096
Jerónimo acusa Sócrates de destruir o direito ao subsídio de desemprego	ent1_opposes_ent2		2009-09-20 00:07:00	http://www.publico.pt/1401446	Jerónimo	Sócrates	https://www.wikidata.org/wiki/Q1688029	https://www.wikidata.org/wiki/Q182367
Manuel Alegre “está cheio de razão”, diz Manuela Ferreira Leite	ent2_supports_ent1		2009-09-20 13:20:00	http://www.publico.pt/1401479	Manuel Alegre	Manuela Ferreira Leite	https://www.wikidata.org/wiki/Q737410	https://www.wikidata.org/wiki/Q444059
Afastamento de assessor é "contraditória" com o timing que Cavaco prometera, diz Jerónimo	other		2009-09-21 18:11:00	http://www.publico.pt/1401684	Cavaco	Jerónimo	https://www.wikidata.org/wiki/Q57398	https://www.wikidata.org/wiki/Q1688029
Louçã não rejeita hipótese de Cavaco abandonar Belém	other		2009-09-21 18:41:00	http://www.publico.pt/1401689	Louçã	Cavaco	https://www.wikidata.org/wiki/Q1442096	https://www.wikidata.org/wiki/Q57398
Sócrates requer abertura de processo contra jornalista João Miguel Tavares	ent1_opposes_ent2		2009-09-21 21:35:00	http://www.publico.pt/1401706	Sócrates	João Miguel Tavares	https://www.wikidata.org/wiki/Q182367	https://www.wikidata.org/wiki/Q23778050
Paulo Portas acusa Sócrates de ter deixado mais de 150 mil desempregados	ent1_opposes_ent2		2009-09-22 17:56:00	http://www.publico.pt/1401837	Paulo Portas	Sócrates	https://www.wikidata.org/wiki/Q58161	https://www.wikidata.org/wiki/Q182367
Sócrates nega “acordo secreto” com Louçã	other		2009-09-22 18:33:00	http://www.publico.pt/1401844	Sócrates	Louçã	https://www.wikidata.org/wiki/Q182367	https://www.wikidata.org/wiki/Q1442096
Jerónimo diz que Sócrates está enganado ao pensar que fica no poder muitos anos	ent1_opposes_ent2		2009-09-23 09:15:00	http://www.publico.pt/1401978	Jerónimo	Sócrates	https://www.wikidata.org/wiki/Q1688029	https://www.wikidata.org/wiki/Q182367
Almeida Santos quer que Cavaco explique afastamento de assessor em plena campanha	other		2009-09-23 09:57:00	http://www.publico.pt/1401933	Almeida Santos	Cavaco	https://www.wikidata.org/wiki/Q611579	https://www.wikidata.org/wiki/Q57398
Silva Pereira acusa Ferreira Leite de trazer “suspeições” para a campanha	ent1_opposes_ent2		2009-09-23 19:23:00	http://www.publico.pt/1402040	Silva Pereira	Ferreira Leite	https://www.wikidata.org/wiki/Q2066785	https://www.wikidata.org/wiki/Q444059
Ferreira Leite acredita que Menezes está empenhado no projecto do PSD	ent1_supports_ent2		2009-09-24 13:32:00	http://www.publico.pt/1402175	Ferreira Leite	Menezes	https://www.wikidata.org/wiki/Q444059	https://www.wikidata.org/wiki/Q6706787
Almeida Santos garante vitória, Sócrates não tem certeza	other		2009-09-24 14:55:00	http://www.publico.pt/1402188	Almeida Santos	Sócrates	https://www.wikidata.org/wiki/Q611579	https://www.wikidata.org/wiki/Q182367
Mário Soares diz que está por esclarecer demissão do assessor de Cavaco	other		2009-09-24 16:41:00	http://www.publico.pt/1402225	Mário Soares	Cavaco	https://www.wikidata.org/wiki/Q156781	https://www.wikidata.org/wiki/Q57398
“Não se iludam, Sócrates é o mesmo”, avisa Ferreira Leite	ent2_opposes_ent1		2009-09-24 22:31:00	http://www.publico.pt/1402277	Sócrates	Ferreira Leite	https://www.wikidata.org/wiki/Q182367	https://www.wikidata.org/wiki/Q444059
Papel de Manuela Ferreira Leite só será discutido depois das autárquicas, diz Morais Sarmento	other		2009-09-27 20:37:00	http://www.publico.pt/1402616	Manuela Ferreira Leite	Morais Sarmento	https://www.wikidata.org/wiki/Q444059	https://www.wikidata.org/wiki/Q10338225
Sócrates vai governar sem coligações mas ao perder a maioria, fica limitado nas suas acções, defende Jacinto Nunes	other		2009-09-27 20:44:00	http://www.publico.pt/1402620	Sócrates	Jacinto Nunes	https://www.wikidata.org/wiki/Q182367	https://www.wikidata.org/wiki/Q10324229
Marcelo Rebelo de Sousa diz que Ferreira Leite não deve sair	other		2009-09-27 22:07:00	http://www.publico.pt/1402627	Marcelo Rebelo de Sousa	Ferreira Leite	https://www.wikidata.org/wiki/Q6756617	https://www.wikidata.org/wiki/Q444059
Sócrates confiante em vitória “expressiva”, António Costa apela à mobilização	other		2009-09-28 22:19:00	http://www.publico.pt/1402788	Sócrates	António Costa	https://www.wikidata.org/wiki/Q182367	https://www.wikidata.org/wiki/Q610788
Sócrates repete estratégia de governação à vista de António Guterres	other		2009-09-29 07:45:00	http://www.publico.pt/1402816	Sócrates	António Guterres	https://www.wikidata.org/wiki/Q182367	https://www.wikidata.org/wiki/Q311440
António Costa acusa Santana de preferir diversão em detrimento do tratamento do cancro	ent1_opposes_ent2		2009-09-29 13:51:00	http://www.publico.pt/1402908	António Costa	Santana	https://www.wikidata.org/wiki/Q610788	https://www.wikidata.org/wiki/Q239248
Rui Rio quer Manuela Ferreira Leite presente na campanha no Porto	ent1_supports_ent2		2009-09-29 15:03:00	http://www.publico.pt/1402922	Rui Rio	Manuela Ferreira Leite	https://www.wikidata.org/wiki/Q7378729	https://www.wikidata.org/wiki/Q444059
Elisa Ferreira quer resolver primeiro “emergências” do Porto deixadas por Rui Rio	ent1_opposes_ent2		2009-09-29 15:52:00	http://www.publico.pt/1402928	Elisa Ferreira	Rui Rio	https://www.wikidata.org/wiki/Q5361358	https://www.wikidata.org/wiki/Q7378729
Vitalino diz que Cavaco clarificou que não há percepção de vigilância do Governo	other		2009-09-29 21:37:00	http://www.publico.pt/1402972	Vitalino	Cavaco	https://www.wikidata.org/wiki/Q10392072	https://www.wikidata.org/wiki/Q57398
Jerónimo considera que declarações de Cavaco revelam “grande crispação institucional”	ent1_opposes_ent2		2009-09-30 15:35:00	http://www.publico.pt/1403105	Jerónimo	Cavaco	https://www.wikidata.org/wiki/Q1688029	https://www.wikidata.org/wiki/Q57398
Santana garante que Ferreira Leite “vai aparecer” ao seu lado na campanha	other		2009-09-30 22:34:00	http://www.publico.pt/1403162	Santana	Ferreira Leite	https://www.wikidata.org/wiki/Q239248	https://www.wikidata.org/wiki/Q444059
Sócrates chega à audiência com Cavaco com cerca de 20 minutos de atraso	meet_together		2009-10-01 16:14:00	http://www.publico.pt/1403296	Sócrates	Cavaco	https://www.wikidata.org/wiki/Q182367	https://www.wikidata.org/wiki/Q57398
Sócrates diz que audiência de 45 minutos com Cavaco foi "uma boa conversa"	meet_together		2009-10-01 16:49:00	http://www.publico.pt/1403300	Sócrates	Cavaco	https://www.wikidata.org/wiki/Q182367	https://www.wikidata.org/wiki/Q57398
Cavaco Silva escusa-se a revelar pormenores da audiência com Sócrates	meet_together		2009-10-01 20:50:00	http://www.publico.pt/1403325	Cavaco Silva	Sócrates	https://www.wikidata.org/wiki/Q57398	https://www.wikidata.org/wiki/Q182367
Jerónimo vai transmitir preocupações dos portugueses a Cavaco	other		2009-10-01 21:02:00	http://www.publico.pt/1403330	Jerónimo	Cavaco	https://www.wikidata.org/wiki/Q1688029	https://www.wikidata.org/wiki/Q57398
Paulo Portas teve conversa “bastante útil e profunda” com Cavaco Silva	meet_together		2009-10-02 15:16:00	http://www.publico.pt/1403444	Paulo Portas	Cavaco Silva	https://www.wikidata.org/wiki/Q58161	https://www.wikidata.org/wiki/Q57398
Louçã leva tema da corrupção a encontro com Cavaco Silva	meet_together		2009-10-02 16:36:00	http://www.publico.pt/1403461	Louçã	Cavaco Silva	https://www.wikidata.org/wiki/Q1442096	https://www.wikidata.org/wiki/Q57398
Marcelo Rebelo de Sousa diz que Ferreira Leite deve levar mandato até ao fim	other		2009-10-02 22:01:00	http://www.publico.pt/1403494	Marcelo Rebelo de Sousa	Ferreira Leite	https://www.wikidata.org/wiki/Q6756617	https://www.wikidata.org/wiki/Q444059
Paulo Rangel defende continuidade de Manuela Ferreira Leite na liderança do PSD	ent1_supports_ent2		2009-10-04 18:21:00	http://www.publico.pt/1403653	Paulo Rangel	Manuela Ferreira Leite	https://www.wikidata.org/wiki/Q10346767	https://www.wikidata.org/wiki/Q444059
António Costa defende novo aeroporto e acusa Santana de não ter programa	ent1_opposes_ent2		2009-10-05 14:38:00	http://www.publico.pt/1403718	António Costa	Santana	https://www.wikidata.org/wiki/Q610788	https://www.wikidata.org/wiki/Q239248
Bagão Félix preside comissão de apoio à lista encabeçada por Santana Lopes	ent1_supports_ent2		2009-10-06 21:16:00	http://www.publico.pt/1403953	Bagão Félix	Santana Lopes	https://www.wikidata.org/wiki/Q2857730	https://www.wikidata.org/wiki/Q239248
Ferreira Leite considera “ridícula” comparação entre Seara e Ana Gomes	more_entities		2009-10-09 15:19:00	http://www.publico.pt/1404447	Ferreira Leite	Ana Gomes	https://www.wikidata.org/wiki/Q444059	https://www.wikidata.org/wiki/Q2844986
Jerónimo de Sousa acusa Paulo Pedroso de ter comportamento antagónico	ent1_opposes_ent2		2009-10-09 22:23:00	http://www.publico.pt/1404494	Jerónimo de Sousa	Paulo Pedroso	https://www.wikidata.org/wiki/Q1688029	https://www.wikidata.org/wiki/Q7155277
António Costa vence em Lisboa, Rui Rio vence no Porto	other		2009-10-11 20:01:00	http://www.publico.pt/1404649	António Costa	Rui Rio	https://www.wikidata.org/wiki/Q610788	https://www.wikidata.org/wiki/Q7378729
Renato Sampaio acusa militantes de não se terem envolvido na candidatura de Elisa Ferreira	other		2009-10-11 20:44:00	http://www.publico.pt/1404656	Renato Sampaio	Elisa Ferreira	None	https://www.wikidata.org/wiki/Q5361358
Manuel Alegre considera vitória de Costa “muito importante”	other		2009-10-11 21:42:00	http://www.publico.pt/1404665	Manuel Alegre	Costa	https://www.wikidata.org/wiki/Q737410	https://www.wikidata.org/wiki/Q610788
Pinto Moreira vence em Espinho e quer auditoria aos executivos do socialista José Mota	ent1_opposes_ent2		2009-10-11 23:29:00	http://www.publico.pt/1404694	Pinto Moreira	José Mota	https://www.wikidata.org/wiki/Q10281394	None
Santana Lopes felicita António Costa pela vitória em Lisboa	other		2009-10-12 00:22:00	http://www.publico.pt/1404709	Santana Lopes	António Costa	https://www.wikidata.org/wiki/Q239248	https://www.wikidata.org/wiki/Q610788
Cavaco Silva indigitou José Sócrates para cargo de primeiro-ministro	other		2009-10-12 11:29:00	http://www.publico.pt/1404799	Cavaco Silva	José Sócrates	https://www.wikidata.org/wiki/Q57398	https://www.wikidata.org/wiki/Q182367
Passos Coelho pressiona Ferreira Leite  e dá tiro de partida para corrida à liderança do PSD	ent1_opposes_ent2		2009-10-13 22:42:00	http://www.publico.pt/1405017	Passos Coelho	Ferreira Leite	https://www.wikidata.org/wiki/Q57615	https://www.wikidata.org/wiki/Q444059
Guilherme Silva considera “prematura” candidatura de Passos Coelho	ent1_opposes_ent2		2009-10-14 14:51:00	http://www.publico.pt/1405135	Guilherme Silva	Passos Coelho	https://www.wikidata.org/wiki/Q10292842	https://www.wikidata.org/wiki/Q57615
Ferreira Leite tem condições para continuar, diz Deus Pinheiro	ent2_supports_ent1		2009-10-14 19:21:00	http://www.publico.pt/1405165	Ferreira Leite	Deus Pinheiro	https://www.wikidata.org/wiki/Q444059	https://www.wikidata.org/wiki/Q722614
António Martins considera acusações “falsas” e “lamenta” postura de Noronha do Nascimento	ent1_opposes_ent2		2009-10-19 18:06:00	http://www.publico.pt/1405850	António Martins	Noronha do Nascimento	None	None
Isabel Alçada diz que não recebeu convite de Sócrates	other		2009-10-22 09:18:00	http://www.publico.pt/1406312	Isabel Alçada	Sócrates	https://www.wikidata.org/wiki/Q3154816	https://www.wikidata.org/wiki/Q182367
Cavaco diz-se disposto a ajudar Sócrates a cumprir quatro anos de legislatura	ent1_supports_ent2		2009-10-27 08:15:00	http://www.publico.pt/1406999	Cavaco	Sócrates	https://www.wikidata.org/wiki/Q57398	https://www.wikidata.org/wiki/Q182367
Jerónimo de Sousa considera o Emprego responsabilidade de José Sócrates	ent1_opposes_ent2		2009-10-31 18:03:00	http://www.publico.pt/1407710	Jerónimo de Sousa	José Sócrates	https://www.wikidata.org/wiki/Q1688029	https://www.wikidata.org/wiki/Q182367
Paulo Portas critica Sócrates por se fazer de "vítima"	ent1_opposes_ent2		2009-11-05 15:02:00	http://www.publico.pt/1408515	Paulo Portas	Sócrates	https://www.wikidata.org/wiki/Q58161	https://www.wikidata.org/wiki/Q182367
